{
  "frameworkVersion": "0.1.0",
  "packageId": "EJPKG-SAMPLE-001",
  "title": "Sample Expert Judgment Package",
  "stakeholders": [
    {
      "id": "STK-CUST-001",
      "name": "Customer",
      "category": "external"
    },
    {
      "id": "STK-ORG-001",
      "name": "Organization",
      "category": "organization"
    },
    {
      "id": "STK-AUD-001",
      "name": "Auditor",
      "category": "assurance"
    }
  ],
  "knowledgeSources": [
    {
      "id": "SRC-INT-001",
      "sourceType": "interview",
      "title": "Veteran review interviews",
      "reliability": 0.82
    },
    {
      "id": "SRC-REV-001",
      "sourceType": "review-comment",
      "title": "Review comments and approval history",
      "reliability": 0.74
    },
    {
      "id": "SRC-AUD-001",
      "sourceType": "audit-record",
      "title": "Audit and incident records",
      "reliability": 0.86
    }
  ],
  "cases": [
    {
      "id": "CAS-SW-001",
      "title": "Permission broadening change",
      "domain": "software",
      "context": "Code review for authorization logic",
      "presentedFacts": [
        "The change passes automated tests.",
        "An authorization rule is broadened.",
        "No threat rationale is attached."
      ],
      "availableEvidence": [
        "diff review",
        "test results",
        "threat model absent"
      ],
      "actualOutcome": "Request was held for redesign.",
      "stakeholderRefs": [
        "STK-CUST-001",
        "STK-ORG-001"
      ],
      "sourceRef": "SRC-INT-001"
    },
    {
      "id": "CAS-OPS-001",
      "title": "Night-shift physical check skipped",
      "domain": "operations",
      "context": "Operations handoff under time pressure",
      "presentedFacts": [
        "Dashboard indicators are normal.",
        "The last manual inspection is stale.",
        "Operator wants to skip local confirmation."
      ],
      "availableEvidence": [
        "dashboard trends",
        "inspection log"
      ],
      "actualOutcome": "Escalated and local check performed.",
      "stakeholderRefs": [
        "STK-ORG-001"
      ],
      "sourceRef": "SRC-INT-001"
    },
    {
      "id": "CAS-ACC-001",
      "title": "Revenue booking with missing fulfillment proof",
      "domain": "accounting",
      "context": "Quarter-end accounting review",
      "presentedFacts": [
        "Commercial approval exists.",
        "Delivery confirmation is missing.",
        "Quarter close pressure is high."
      ],
      "availableEvidence": [
        "approval email",
        "contract",
        "missing delivery receipt"
      ],
      "actualOutcome": "Revenue recognition deferred.",
      "stakeholderRefs": [
        "STK-ORG-001",
        "STK-AUD-001"
      ],
      "sourceRef": "SRC-AUD-001"
    },
    {
      "id": "CAS-MTN-001",
      "title": "Reuse worn gasket",
      "domain": "maintenance",
      "context": "Restart preparation after inspection",
      "presentedFacts": [
        "The gasket still seals at rest.",
        "Wear is near the failure threshold.",
        "Replacement would delay restart."
      ],
      "availableEvidence": [
        "inspection photos",
        "wear measurement",
        "restart schedule"
      ],
      "actualOutcome": "Replacement required before restart.",
      "stakeholderRefs": [
        "STK-ORG-001"
      ],
      "sourceRef": "SRC-INT-001"
    },
    {
      "id": "CAS-ADM-001",
      "title": "Urgent procurement with missing approval",
      "domain": "administration",
      "context": "Administrative approval under onboarding urgency",
      "presentedFacts": [
        "Request is labeled urgent.",
        "Budget owner approval is missing.",
        "Onboarding start date is near."
      ],
      "availableEvidence": [
        "procurement request",
        "approval chain",
        "onboarding schedule"
      ],
      "actualOutcome": "Emergency waiver path required.",
      "stakeholderRefs": [
        "STK-ORG-001",
        "STK-AUD-001"
      ],
      "sourceRef": "SRC-REV-001"
    },
    {
      "id": "CAS-SW-002",
      "title": "Permission change with explicit threat rationale",
      "domain": "software",
      "context": "Code review with exception evidence",
      "presentedFacts": [
        "An authorization rule changes.",
        "Threat rationale is documented.",
        "Negative tests demonstrate denied access for excluded roles."
      ],
      "availableEvidence": [
        "diff review",
        "threat rationale",
        "negative tests"
      ],
      "actualOutcome": "Approved with trace note.",
      "stakeholderRefs": [
        "STK-CUST-001",
        "STK-ORG-001"
      ],
      "sourceRef": "SRC-REV-001"
    }
  ],
  "cues": [
    {
      "id": "CUE-SW-001",
      "statement": "Authorization scope changed without threat rationale",
      "cueType": "document-gap",
      "detectionMethod": "review diff against expected rationale",
      "salience": 0.92,
      "ambiguityNotes": "May be harmless only if scope reduction or equivalent negative evidence exists."
    },
    {
      "id": "CUE-OPS-001",
      "statement": "Remote dashboard is normal while local inspection evidence is stale",
      "cueType": "missing-evidence",
      "detectionMethod": "compare dashboard state with inspection freshness",
      "salience": 0.84,
      "ambiguityNotes": "Dashboard health is insufficient when field drift is plausible."
    },
    {
      "id": "CUE-ACC-001",
      "statement": "Recognition approval exists without completion evidence",
      "cueType": "missing-evidence",
      "detectionMethod": "match booking claim to fulfillment proof",
      "salience": 0.9,
      "ambiguityNotes": "Commercial certainty is not accounting completion evidence."
    },
    {
      "id": "CUE-MTN-001",
      "statement": "Component still functions but is near tolerated wear limit",
      "cueType": "structural-risk",
      "detectionMethod": "compare measurement to wear threshold",
      "salience": 0.88,
      "ambiguityNotes": "Current function can hide restart failure risk."
    },
    {
      "id": "CUE-ADM-001",
      "statement": "Urgency request is used to bypass delegated approval authority",
      "cueType": "exception-signal",
      "detectionMethod": "compare urgency claim to approval chain",
      "salience": 0.81,
      "ambiguityNotes": "Emergency path is distinct from ordinary urgency."
    }
  ],
  "concerns": [
    {
      "id": "CON-SW-001",
      "statement": "Unauthorized access could be normalized through under-explained changes.",
      "harmMode": "security and trust loss",
      "affectedParties": [
        "users",
        "organization"
      ],
      "escalationTrigger": "Access expansion lacks explicit rationale or negative evidence."
    },
    {
      "id": "CON-OPS-001",
      "statement": "Field degradation could be missed if remote signals are treated as sufficient.",
      "harmMode": "operational failure",
      "affectedParties": [
        "operators",
        "organization"
      ],
      "escalationTrigger": "Local condition is unknown while service continues."
    },
    {
      "id": "CON-ACC-001",
      "statement": "Financial reporting could be misstated by premature recognition.",
      "harmMode": "audit and reporting harm",
      "affectedParties": [
        "organization",
        "auditors"
      ],
      "escalationTrigger": "Required completion evidence is missing at booking time."
    },
    {
      "id": "CON-MTN-001",
      "statement": "Restart could depend on parts already beyond acceptable wear tolerance.",
      "harmMode": "safety and reliability failure",
      "affectedParties": [
        "operators",
        "organization"
      ],
      "escalationTrigger": "Component is near or beyond tolerated wear with no approved waiver."
    },
    {
      "id": "CON-ADM-001",
      "statement": "Authority and auditability could be bypassed in the name of convenience.",
      "harmMode": "control failure",
      "affectedParties": [
        "organization",
        "auditors"
      ],
      "escalationTrigger": "Commitment proceeds without delegated approval."
    }
  ],
  "lossBoundaries": [
    {
      "id": "LSB-SW-001",
      "statement": "No user may gain access they were not entitled to without explicit, reviewable rationale and evidence.",
      "severity": "critical",
      "irreversibility": "high",
      "stakeholderRefs": [
        "STK-CUST-001",
        "STK-ORG-001"
      ],
      "waiverAuthority": "Security owner"
    },
    {
      "id": "LSB-OPS-001",
      "statement": "Equipment must not remain in service when local condition is materially unknown.",
      "severity": "high",
      "irreversibility": "medium",
      "stakeholderRefs": [
        "STK-ORG-001"
      ],
      "waiverAuthority": "Operations manager"
    },
    {
      "id": "LSB-ACC-001",
      "statement": "No revenue recognition without required completion evidence or policy-approved substitute evidence.",
      "severity": "critical",
      "irreversibility": "high",
      "stakeholderRefs": [
        "STK-ORG-001",
        "STK-AUD-001"
      ],
      "waiverAuthority": "Controller"
    },
    {
      "id": "LSB-MTN-001",
      "statement": "Restart must not rely on components already beyond tolerated wear margin.",
      "severity": "high",
      "irreversibility": "high",
      "stakeholderRefs": [
        "STK-ORG-001"
      ],
      "waiverAuthority": "Engineering authority"
    },
    {
      "id": "LSB-ADM-001",
      "statement": "Commitments must not bypass delegated approval authority outside a documented emergency path.",
      "severity": "medium",
      "irreversibility": "medium",
      "stakeholderRefs": [
        "STK-ORG-001",
        "STK-AUD-001"
      ],
      "waiverAuthority": "Administrative director"
    }
  ],
  "expertJudgments": [
    {
      "id": "JDG-SW-001",
      "caseRef": "CAS-SW-001",
      "expertRole": "senior reviewer",